Text,Emotion
im a creature of habit and major life changes always leave me feeling sort of dazed confused and occasionally sad and grumpy,surprise
i feel a bit overwhelmed in some areas so i may come off as whiney,surprise
i just feel a weird vibe,surprise
i shrugged not feeling particularly enthralled about the educational tour and feeling guilty that i would prefer to stay at home and play house,surprise
i talk to my real estate agent for some advice on how to proceed not that i feel she will offer much again im not too impressed with her,surprise
im feeling a bit overwhelmed tonight and not really for any good reason,surprise
i do remember the feel of the book and being incredibly impressed with it and knowing that ill have to read it again,surprise
i feel amazed how this sh it things happened to me,surprise
im lacking in the accessory department but i have a feeling that once i actually start putting the things i own in one place i might be a little more surprised at what i find,surprise
i have no idea if this is interesting for anybody to read but i found myself smiling like a fool laughing at some points and feeling overwhelmed with gratefulness,surprise
i feel that this is something i m curious about as someone who listens to current music but i realized that songs become weird and their unique vibe gets lost when non korean songs are translated into korean,surprise
i just be feeling curious about a few tings,surprise
i still feel amazed by its beauty diversity and joie de vivre,surprise
i did in fact feel very strange,surprise
i feeling strange energies,surprise
i feel a little funny discussing the realness of a portrayal of a condition ive never experienced,surprise
i haven t seen her since they broke up but now i m in this class and she is here waving at me so i go and sit next to her and get out my stuff and talk to her but i feel really strange about it because she cheated on my friend which i really should have mentioned before,surprise
i had a hard time focusing on my life and walked around feeling dazed and confused,surprise
i feel only a little bit weird about making decisions without him,surprise
i feel impressed to discuss sin again though i do not know why,surprise
i was feeling like a shocked rat in a skinner box experiment,surprise
i admire makes me feel amazed at my life,surprise
i just remember feeling so amazed that this little person and i am only a child was my new brother,surprise
i can remember i feel especially impressed to start fresh new and remove clutter,surprise
i feel surprised when i looked new,surprise
i dont want to put to much pressure on myself but i feel like i could make the most amazing year ever,surprise
i have to care about and care for people with disabilities who are targeted by sensationalist media reports as well as at the same time feel the sorrow i do for the parents family members and community in newtown connecticut that is stunned by the events of today,surprise
i have also been feeling completely overwhelmed and so incredibly unappreciated,surprise
i will be honest it did feel a little strange being in the company of such greatness,surprise
i got contact lenses the other day and am trying to get used to them i feel like my face looks really weird without glasses and its so strange when i see myself from a distance,surprise
i am just waking up with not nearly enough sleep and feeling dazed,surprise
i kept thinking about how awesome i would feel afterwards remembering how amazing i felt after my emotional spin class the previous night,surprise
i thought about it a lot this weekend because i watched the fault in our stars which is about two kids who have cancer so that made me feel really weird and anxious,surprise
i am feeling a little overwhelmed but ive been given some amazing tools met some wonderfully creative fun and crazy people and was reminded that i have a voice that has been silent for too long,surprise
i was mightily nervous given that i crashed and burned at this point last time and i still remember feeling shocked at how hard i found the x second runs,surprise
i feel like im getting there i have to admit i was stunned when i realized my list my entire laundry list of here to for impossible pie in the sky dreams,surprise
i did not feel any emotion or was deeply saddened or stunned for that matter,surprise
i accidentally feel the mood and jumped into blogspot then what surprised me was for over views lol,surprise
i remember looking out car windows as i was passengered around those first few months and feeling vaguely surprised as i was already deep in shock at how different things looked,surprise
i know that i will always feel a little bit strange and out of place in the academy,surprise
i feel weird knowing mine died when i wasn t around,surprise
i actually prefer peep toe shoes because of it because then i wont notice that my shoes feel funny,surprise
i started feeling dazed,surprise
im feeling more than a little dazed,surprise
im not sure how i feel im shocked honestly,surprise
i say walking away and shaking my head feeling a little dazed to get the drinks,surprise
i still feel a little bit funny when i discover his fb damn it,surprise
i might go out of existance i smile pick up my pen and fill the page with the things that you say the thoughts you obtain the moments you refrain far away its cause youre going insane and suddenly im left afraid because im not feeling that way instead im amazed why you gotta be that way,surprise
i feel a little overwhelmed this weekend i went out to the beach and just stood in the surf watching listening and feeling the waves come in and out,surprise
i couldnt help but feel a little curious about it though which is what finally led me to plan to rent it this evening,surprise
i feel a bit surprised that motion capture films dont seem to me to have the visual richness and detail that full cgi films have,surprise
i feel funny cause bonka neva thanked me fa his awards,surprise
im feeling a little overwhelmed,surprise
i notice i jump when i feel anything in my hair which i cant say im surprised about,surprise
i think many may dislike it as i do and still feel they should be impressed by it the educated and privileged may now be more susceptible to the mass media than the larger public they re certainly easier to reach,surprise
ive suffered from eating disorders and depression since i was and i feel amazed to say that i consider myself recovered now,surprise
im beginning to feel my way around the systems and im very impressed with the overall level of automation and control that goes into making memset what it is,surprise
i feel when you should walk in to see the film you should be pleasantly surprised with the film s inherent connect,surprise
i still feel a bit stunned and i suppose i should be racked with regret and shame,surprise
i do like to think that in the near future ill feel the urge to write up an album or two that has really impressed me most likely a href http handsomefamily,surprise
i feel less weird about my premature graying that started,surprise
i feel shocked that my photo was chosen as the best photo of the week,surprise
i have no relief from my aches i am feeling just a tad overwhelmed by our current living situation and i am still unemployed and getting really really antsy about finding work,surprise
i would feel weird having my dads hand on my stomach for any amount of time especially for several minutes while he waits to feel taryn jumping around in there,surprise
i would say to mira i am feeling really curious about what its like to live in a castle and im looking it up on my computer,surprise
i am feeling a little overwhelmed like i do every year at this time at the speed each holiday season creeps up on us,surprise
im feeling amazing because im answering these questions from new york so life is good,surprise
i feel as if i am on hold somehow that ive been given a time for contemplation consolidation and it is a most curious feeling,surprise
i feel dazed and unsure of a world in which dying young and disasters that sacrifice so many lives in one swath happen let alone happen with frequency great enough to make me cringe,surprise
i stood kind of dumbfounded looking around feeling culture shocked,surprise
i feel an urgency to introduce readers to the amazing and touching story of anna iya and erik,surprise
i feel somewhat surprised when reading george hobica s discussion on usa today,surprise
i feel a remembrance of the strange by justin aryiku falls into the latter category,surprise
i start an aimless internet search when im feeling curious,surprise
i feel in retrospect if i have the ability to think back that all this history stuff and the miles upon miles of newsprint that has carried my feature articles impressed and impacted the readership the way it was intended,surprise
im feeling overwhelmed,surprise
i feel very shocked i have never expected that would happen to me,surprise
im still not sure why reilly feels the need to be so weird,surprise
i am feeling a bit overwhelmed tired anxious etc,surprise
i feel like falling in love with her is part of being amazed at how she makes our family so much better she tells the advocate,surprise
i am feeling amazed to see what god is doing new friends who aren t only amazing but get me who don t run and hide in a dark room unless i am there and they are joining me,surprise
i usually doubt my self at this point as i feel i should be that amazing housewife who motors all day and has a list of things they can tell theyre husband they did all day while they were at work and i was at home,surprise
i am feeling a curious sense of relief a lightness that i never thought possible back when sex seemed to be the most desirable of desires and the ultimate act of self validation,surprise
i feel so amazed seeing chiangmai,surprise
im not quite sure why and she treated me well but the entire time i was there i got this distinct feeling that she wasnt impressed,surprise
i admit to feeling bitterly surprised at how rapidly they have thrown in the towel,surprise
i remember frequently feeling surprised by the statistic that of the population are hsps given that i almost never came across anyone who was an hsp,surprise
i hope you keep handing out books of mormon to those you feel impressed to give them to,surprise
i bit my lip as he slightly whispered this will feel weird tell me if i hurt you,surprise
i get the feeling that i impressed ecker,surprise
i was a tad more jaded stopping the booth rep from reciting his memorized spiel by mentioning that i had been following the unit for a year but came away feeling pretty impressed,surprise
i have a curious feeling that benjamin button is the next forest gump curious case of benjamin button review a href http stayviolation,surprise
i feel that chris is not too impressed with my stuff so naturally i hate myself and want on the next plane back to seattle as soon before the showcase as possible,surprise
i just really feel so curious about whether you and dad have ever been bitten,surprise
i am not a catholic i certainly don t feel it is my place to take sides on this issue but i am curious how the leadership of the catholic church will mesh with its own people over these issues in the coming years,surprise
i will make you feel amazing tonight i need you no,surprise
i feel about it has me shocked,surprise
i just posted when i reached to someones facebook that i used to think as one of my best friends which makes me feel so shocked and frustrated,surprise
i remember last summer feeling so overwhelmed,surprise
i feel amazed to say that i am doing what i only dreamed of doing again,surprise
i do when i m feeling a bit weird to reground myself,surprise
i remember feeling shocked and somewhat embarrassed that the adf unity rite i was consecrated in was so much about me,surprise
i see lyman i just feel more and more amazed about us,surprise
i mean architectural wonders just make you feel wowed impressed and you just end up really respecting the people who built them but nature just makes you feel so much more aware of the world around you without actually actively doing anything because they were always there you know,surprise
i know so many people rave about it that i m feeling a bit weird,surprise
i was cut into feeling pain that shocked me,surprise
i am not desperate for a job and don t really feel impressed to go find a job because i have one img src http randythomas,surprise
i will tell ya i have been following a very norma inspired diet for a week tomorrow and i feel amazing,surprise
i feel quite surprised that i have a fairly significant amount of blog readers,surprise
im feeling awfully overwhelmed by everything right now the demands from mother the needs of my family trying to shield my dear husband from as much as possible the list goes on and on,surprise
i feel amazing doctor,surprise
i won t say that i didn t feel any fear because i did but i was surprised at how calm i was,surprise
i actually found myself resenting the song for making me feel which is weird for me because i used to play guitar and sing in church like all the time and music was a huge part of my life in college and high school,surprise
i had on my plate without the stress of feeling completely overwhelmed,surprise
i feel like i should admit to her how many times a week i make pasta for dinner and that i never make my bed at school so shes less impressed or something,surprise
i don t have the longevity or experience in the field to get a feeling for that and i m curious as to what the speculation might be,surprise
i even like to play with my negative feelings by becoming curious,surprise
im feeling is funny because its totally unnecessary,surprise
i sat down at the table for lunch after proclaiming how amazing i felt considering i started to feel weird,surprise
i am trying not to feel so overwhelmed with everything i am trying to make small steps,surprise
i feel shocked robbed and shaken of everything i thought i wanted,surprise
i was feeling amazing so i was disappointed when my lab work in december came back the same way it did the previous year overall it was good but i did not have enough protein in my diet,surprise
i may give up much sooner than my days if i feel like im gonna die but ive been curious for a while,surprise
i have stopped feeling surprised,surprise
i went to work but i feel stunned and numb,surprise
i feel strange pangs of loneliness or emptiness bubble up,surprise
i wonder why i feel surprised that things are different than i expected,surprise
i remembered seeing these pieces and feeling so impressed by them but seeing them again i was surprised i was blinded by my memories,surprise
i just feel curious of what my mission is to be,surprise
i feel a little funny about being so open and personal in my sandblog but if admitting all of this helps me achieve my wish than it s worth it,surprise
i often hear that i give a feeling like i m longer here and folks are surprised to hear that i m only years old hyphen,surprise
i found the art at the other side of all i feel very impressed with my work,surprise
i always feel a little weird writing about a guy ive dated because i dont want to do them an injustice or have them come across in a negative way,surprise
i feel weird tonight,surprise
i feel a strange sensation course through my limbs,surprise
i don t know how sasha fierce feels i m definitely curious about the future of beyonc s sound,surprise
i am feeling quite curious and concerned,surprise
i like the padding because it makes the ride more comfortable but it feels funny to walk in when not riding let alone what it looks like lol,surprise
i use vegetable glycerin in my oil cleansing mixture each night and my skin always feels amazing when i use glycerin,surprise
i think im getting the feeling that were the weird ones for using dryers most of the time,surprise
im more attracted to him because i feel that he knows that hes weird and being a weirdo myself i figure things might work out,surprise
i feel like this inside theres one thing i wanna know whats so funny bout peace love and understanding,surprise
i start to remember how desperately i felt when trying to get pregnant after feeling impressed to start having a family and soon finding that its not as easy as you think to just get pregnant,surprise
i feel ludicrous even thinking these things,surprise
i feel like itd be strange at the least and possibly offensive to tell a gay friend id like to experiment or something like that,surprise
i visit this brand for the first time i feel surprised there are so many accessaries at our website,surprise
i feel the most overwhelmed,surprise
i got the feeling that steve was impressed that bi was used in manufacturing and not only in finance as in the us,surprise
im feeling less impressed with the speech this morning than i was last night,surprise
i love they way they feel in my hand im sort of shocked i dont have some psycho fetish,surprise
i feel weird in the companies of those who approve and disapprove of dot com marriages,surprise
i feel so amazed with myself as i could stride nonstop for more than minutes,surprise
i kept waiting to feel the water and when i did i was surprised at the velocity i gained,surprise
i find myself feeling shocked hearing that word spoken out loud in my own lounge room,surprise
i think i deserve for once this freedom makes me feel amazing,surprise
i am feeling a bit overwhelmed here,surprise
i was feeling quite impressed with myself for taking just eight months to finish just the lyrics for one fairly simple though sufficiently tortured emo song,surprise
i am nowhere near finished but how much better do i feel its ludicrous,surprise
i feel developers should hear that people are really impressed with their work if they are,surprise
i still end up feeling a bit dazed from sheer sensory overload after spending an extended time in a very crowded area but today it wasnt too bad and the good company more than made up for it,surprise
im feeling a little impressed at their creativity,surprise
i used to feel when i was still a child being very curious and innocent with everything and everyone around me,surprise
i still feel a little weird calling the ceo of my company bob but relented after he corrected me repeatedly,surprise
i get that sick feeling like the one you get when you hear that someone passed away and youre shocked and lightheaded and i realize hes really gone forever,surprise
i don t usually blog when i m feeling this way but i m actually curious to see if i can put it into words,surprise
i always feel so flattered when another amazing blogger asks me to share a little of world on their blog so here it goes,surprise
i cant help feeling curious you know after all ive heard,surprise
i miss the feeling of feeling amazing,surprise
i left feeling slightly dazed confused and disappointed,surprise
i feel like i should say something but im shocked into silence,surprise
im feeling a little dazed and confused today,surprise
i i have all the predictable feelings loki is that guy i know from many many other fandoms im not impressed with me for my loki feelings,surprise
i feel and i was amazed to find out where papamoka shows up,surprise
i closed my eye taking in the feeling wishing that i could go back in time and re live these amazing moments when i opened my eyes i was taken back by fahad s presence he was leaning against the skeleton of the swing set and smiling at me,surprise
i know also that many others especially parents feel shocked and betrayed at what has been revealed,surprise
i feel funny without,surprise
i feel so amazed ive had views in the past week,surprise
i have some minor neuropathy going on in my fingers and my fingernails feel funny sensitive so that might mean that i could be losing them soon,surprise
i feel slightly dazed and tired and angry but that is a normal emotion and mood for me to experience from day to day or week to week,surprise
im excited for these new changes cause i really feel like it will help me feel like myself again in this funny blogging world,surprise
i feels shocked looking at the elder fitch twin,surprise
i was okay with it but still little have feeling for that my brother was more amazed he like mihm but he wasn t going to get playing time,surprise
i dont mean to boast but i feel rather impressed by my message,surprise
i am feeling quite impressed with myself because i went two directions across the top row and down the left column,surprise
i feel like a monster because as we make our way through the rubble and stunned bodies all im thinking is that we need to find a way to keep going,surprise
i feel funny about saying any of this because the book is selling millions of copies every week and it seems i m the minority in this,surprise
i was feeling this really weird sense of isolation that would have creeped me out pretty bad if i was alone,surprise
i cannot begin trying to understand how it must feel to be surprised by an earthquake or see the devastating pictures live to escape from a tsunami,surprise
i wake up feeling dazed from deep slumber and convoluted sometimes exhausting dreams a bit like a href http skdd,surprise
ill add i havent tried all that time but i do feel as i adapt and pick up techniques quickly this is one of the things im amazed that its taken me this long,surprise
i also feel curious when i read all the readings because not only i want to have depth understanding of social constructivism itself but also i found this unit gives opportunity for me to understand the philosophy of each type of constructivism,surprise
i love seeing what books resonate with my girls i love seeing their faces grow serious when characters face complications trials and obstacles and i love the discussions that come out of reading time as we talk about main ideas how the books made us feel and what may have surprised us,surprise
i wake up feeling kind of dazed and groggy,surprise
i still feel quite amazed at how silent snow is compared to rain,surprise
i feel so curious why she add me back,surprise
i learned about taking a dip in the dating pool its that in relationships its always better to feel surprised than disappointed,surprise
i looked back at her feeling myself desperately curious,surprise
i feel enthralled by the lyrics and the rhythm,surprise
i was aware of feeling so surprised so disappointed i don t think i ever really thought i d have to have a c section,surprise
i feel surprised by my reaction because as a younger woman i always thought i would be a darling older woman,surprise
i was supposed to be working on a grant application but feeling overwhelmed i decided to curl up with my computer and netflix,surprise
i feel a bit stunned actually,surprise
i feel very shocked by how many people i talk to who havent seen this movie,surprise
i feel like im craving it and then no matter what i order i just really am not that impressed,surprise
i have only taken three rolls shots so far and really i have been feeling my way with a very strange camera a lightmeter and the long forgotten thought processes of slow photography,surprise
i declined this invitation but secretly i could not help but feel curious,surprise
i can feel that the two girls are shocked with what i m saying,surprise
i suspect that a few feel revulsion it elicits a weird uncomfortable fascination,surprise
i had the feeling he didnt and he actually seemed impressed with me or i should say my work and my range of skills,surprise
i feel a strange connection to them a familiarity that most of the time i link to ancestral memory,surprise
i feel amazed knowing that it had been even bigger,surprise
im feeling funny a href http,surprise
i feel weird sharing that but this is the source of some of my greatest insecurities,surprise
i can run and it feels amazing,surprise
i returned to the ground floor feeling dazed,surprise
i feel this ad does i m not impressed,surprise
i feel that im as curious as when i was a child,surprise
i hardly feel they have any wow factor at all until i saw how stunned liv was at the entire concept,surprise
i immediately related to feeling curious about everything,surprise
im trying to do something often i just look at the whole problem and feel overwhelmed by it then sometimes avoid the issue for as long as i can,surprise
i feel amazing after every thrift trip i got on and to have some many in a small amount of time if my idea of bliss once i am earning again i will re claim my crown of thrift princess,surprise
i enjoy reading immensely and i feel strange or off when i m in between books or just lack the time to read,surprise
i feel shocked his words very pure very self,surprise
i shouldn t have been surprised by the amount of courage that these men had but i can t help but feel slightly shocked by it,surprise
i feel so weird about it,surprise
i feel like i m living in a strange world my wife s paternal grandmother often said,surprise
i sit here feeling dazed after spending most of the afternoon in a comatose state i realise that hours in a day is not enough to do things we really want to,surprise
i finally have access to the website on our development site and am in absolute rapture and delight over how it looks feels and even functions and amazed that my baby has finally arrived,surprise
i feel so strange and sick i have to wake up in three hours seems like everything runs in threes now days t r e e s,surprise
i know theres no hurry to get it done but it still feels a bit weird to not be checking out the newest patch content,surprise
im happier when im feeling curious and genuinely looking forward to the next page alone in my reading chair next to the heater curled up in a blanket than when im muddling through guild wars or wot,surprise
