Text,Emotion
i feel like i quote him or talk about him much but it is only because i am continually amazed and nourished by his spirit and his understanding and excitement for life,surprise
i feel like when i left scad i was finally coming into my own and making work that impressed people,surprise
i remember feeling shocked by the emotions because after all i was pregnant too and at that point we had no reason to think anything was wrong,surprise
i feel you jerked a little surprised at the hand that touched you,surprise
i think back to everything that happened in the book im left feeling stunned,surprise
i started going down the adventure feeling totally ludicrous and wondering if this wasnt all just a waste of my time thats when i saw this screenshot,surprise
i think are close to me as online friends also feel they still very curious about me,surprise
ive done while not writing was had flowers delivered to someone just because brought a meal to a new mom on a day she was feeling overwhelmed and now im stumped trying to remember what has been done,surprise
i am so burdened to be a spiritual father to all generations and i really feel impressed that each and every believer should do so,surprise
i remember feeling overwhelmed and noted the particular smell off the city mostly cigarettes and people with wafts of charred something,surprise
i can feel dazed by all those choices so much so i find myself standing still in front of that blank page unable to make a move,surprise
i feel amazed because when he watch his victim intensely the lying blonde has a pretty face like a girl his skin so smooth his lips so soft and pink and,surprise
i know i have an international audience but even now i feel pleasantly shocked that i can reach certain parts of the world,surprise
i always feel like i need drugs after which is funny cuz its a health food store,surprise
i wonder why people feel the need to make up stories to be amazed at the miracles around us every day,surprise
i discovered out what created my wife feel lovedi was shocked,surprise
i did feel my heart rate increase after the baths and i am curious as to how they d work in the long run on a fat loss plan but between the cost of lbs of ice at a time and the increasingly low temperatures in my apartment i gave them up after a short run,surprise
i feel like every day i walk around with so much stress and sadness that im literally amazed im still here that i still function that im still basically a friendly stable person,surprise
i feel weird taking up time and making these sometimes terrible sounds that people have to hear,surprise
i fight for him when i feel it is just he said and alexander s gaze seemed to turn curious,surprise
i feel curious and bewildered,surprise
i always feeling strange internal feeling like continuous wailing of siren in my head and when nobody hears i couldnt help crying like a siren when no one heard,surprise
im writing this blog post and feeling totally amazed at this wonderful life we lead,surprise
i can remember feeling really amazed at how i could settle down in my playroom read bombsite conservatory and find myself escaping into a whole new place altogether,surprise
i feel like i have weird sugar issues that my hunger is all over the place,surprise
i feel like a bit of a strange one,surprise
i think its time to find better stress management techniques and choke back this feeling of being overwhelmed,surprise
i feel a bit strange saying it,surprise
im not sure if anyone else will feel these but i was pleasantly surprised by my read of the first and second book,surprise
i can legitimately offer to anyone in the program somehow i feel they would be less than impressed by adrasteius and eulalias adventures tho i submit that they are fan freaking tastic,surprise
i feel its a weird turn of events which is marred a bit by a slightly weird prose,surprise
i feel absolutely amazing,surprise
i always feel overwhelmed with a mixture of feelings while listening to these songs,surprise
i want to feel amazed a little more often,surprise
i shook my head feeling dazed,surprise
id love to know in the comments i feel like its a funny thing but i always love reading about how people schedule their days,surprise
im feeling a little overwhelmed here recently,surprise
i feel the tug of the fabric against my thighs and butt i am overwhelmed with the feeling that i am just too fat,surprise
im sure youre not alone in feeling a little funny about enjoying art even black created and black endorsed art littered with a term that would brand you as hateful backward and racist with a capital r if you uttered it in conversation,surprise
i feel gratitude for the opportunity to have met so many amazing people through the magic of the internet,surprise
im also feeling overwhelmed by how often im saying im too old for that shit,surprise
i started feeling a bit strange,surprise
i dont watch a whole lot however when i do i turn off the tv and feel stunned,surprise
i feel like i ve impressed a lot of the scientists with my ability to quickly pick up all the skills expected of a tech,surprise
ive been feeling for awhile and he looked at me with a surprised look and said is that you,surprise
im not feeling overwhelmed by school just yet i only give that a week or so hah,surprise
i feel kind of strange,surprise
i am not sure why in that moment that i thought i would be able to feel it hellip but it was pretty funny,surprise
im feeling extraordinarily dazed and bewildered this arvo for no particular reason and my muscles all hurt even though i dont actually have any,surprise
i feel like amazing x men compensated enough to earn it a out of,surprise
i feel dazed deserted,surprise
i feel surprised that scientists to actually question about how it is weird for the initial conditions of the universe to be fine tuned to very special values such that our universe is almost flat,surprise
i still feel so amazed knowing i stood right in front of jason,surprise
i spent some time at the school yesterday talking to folks and snapping pics of my daughters as they delighted in the last day of school fun and i came away feeling impressed and happy which to tell the truth is my usual feeling about the place,surprise
i could feel myself hit this strange foggy wall,surprise
i winced and said that does not feel funny,surprise
i feel the need to say that i was very amazed with the quality of the presentation and the resources which mack michaels puts forward,surprise
i could spend hours on a set and feel amazing,surprise
i feel impressed to talk to my older children about my vision for our family and enlist their aid in accomplishing it,surprise
i have to fight from feeling overwhelmed by it all,surprise
i feel curious about the subject matter,surprise
i know the playwright robert reid socially and i feel a bit weird being so critical of work by someone im kinda sorta friends with,surprise
i feel could be amazing but like wonder woman is rarely handled well,surprise
im feeling this little one move a lot now and im constantly surprised by his her little kicks,surprise
i am feeling a lil overwhelmed again,surprise
i was feeling overwhelmed,surprise
i dont i feel amazed,surprise
i feel like when i was a kid it was constantly impressed upon me how awesome ants are,surprise
i were discussing on freedom and economic growth in global civil society i cudnt help but feeling amazed our frens in da philippines dat they r happy maintain basic living condition without rapid development as long as their freedom is not being touched,surprise
i also don t know why is the reason of this freaky feeling that disturb my funny mood it should be but it don t,surprise
i personally feel amazed that i have managed to connect with such amazingly talented and creative people through this little world of dance,surprise
i am a boy i like girls they are pretty and i like it when they smile at me but it makes me feel funny,surprise
i am currently feeling i wouldnt surprised if its flipped again,surprise
i barely even feel like explaining the weird history of shadow dancer the not really console port of the arcade sequel to shinobi even though there was already a console sequel to shinobi thats a totally different game the revenge of shinobi,surprise
i feel fighter move in me and i am amazed at the way he and my tummy is growing so quickly,surprise
i get the feeling that hes not impressed with me,surprise
i started back at work i have to admit that ive been feeling a little overwhelmed,surprise
i remember feeling shocked that he had called me religious,surprise
i find myself still feeling curious when i log into sl,surprise
i feel like the hymn says i stand all amazed at the love jesus offers me confused at the grace that so fully he proffers me,surprise
i still feel slightly strange with sorrow but i know its not something of god but of satan,surprise
i feel strongly impressed that there must be something for me to do,surprise
im just nosy or i like to see the process or behind the scenes of a peice but i feel like i should at least provide a little treat to everyone who is curious like me,surprise
i feel thompson needs to work on then again i m not exactly impressed by flash and fluff,surprise
i feel amazing when i lift,surprise
i pick out of the air and feel curious about,surprise
ive seen how mean other kids and adults can be to a child who doesnt fit into the norm and no way was i going to label him so he could be made to feel he was anything other than amazing,surprise
i have a feeling that my plant may have been temperature shocked,surprise
i was feeling pretty overwhelmed and stressed out over the whole affair but a few minutes of straightforward logical there totally is a right answer algebra combined with overhearing some trigonometry another tutor and tutee were working on at the library calmed me right down,surprise
i always find the way to feel and be impressed,surprise
i should not have shared my feelings with him but i was shocked by them too,surprise
i know im making a big deal out of it but i feel quite shocked that i can drive,surprise
i cant help feeling a strange variety of relief for that,surprise
i feel funny just calling it a film,surprise
i was like oh thats awesome blah but then he was like reminding me hes interested in this other girl and i was like i know this but what concerns me more is if it makes you feel too weird to be with me like this,surprise
i can say one good thing about this movie and thats the computer generated transformers took on a truly real look and feel i was amazed at how fluidly them integrated with the live action and just how good they looked in general,surprise
i would be feeling i am genuinely shocked and surprised that he just hit jude,surprise
i often pass by the streets of jurer and feel impressed by some nice constructions and safe atmosphere it has,surprise
ive been medicated today but i feel funny,surprise
i didnt feel as amazed as i expected their nail area is quite small and isnt very posh and cushy like i hoped,surprise
im feeling a bit dazed and out of sorts like someone needs to poke me to really wake me up,surprise
i was feeling strange downstairs i could still feel the dull sensation of the contractions but the nurse said she didnt want to check me for about an hour,surprise
i even feel it is a game that i am a part of some strange reality swarming with violent carnivores adding to the bare landscape of the place i now know,surprise
i spent a lot of time feeling a bit stunned that they thought i was that awesome,surprise
i believe the most readers feel impressed by the individual journey,surprise
i have to admit im feeling pretty overwhelmed,surprise
i am feeling much like the guy in the pic above a little overwhelmed and starved for time but very delighted to be making new work and preparing my little florida bungalow for thanksgiving guests this weekend,surprise
i need to do this that and the other for college by such and such a date because for the past four years ive always felt like ive been needing to do something college based and now i dont but i still have that feeling its really weird i feel almost guilty in fact,surprise
i feel a little stunned but can t imagine what the folks who were working in the studio up until this morning are feeling,surprise
i feel shocked and sad at the fact that there are so many sick people,surprise
i am right handed however i play billiards left handed naturally so me trying to play right handed feels weird,surprise
i was so uncomfortable and feeling weird feelings but wasn t sure if they were contractions since i never really felt contractions with jared until they jacked me up with pitocin,surprise
i think i wanted audiences to feel impressed inspired or entertained when i was on stage,surprise
i will practice meditation if i feel overwhelmed and hopefully become successful in peaceful practice,surprise
i just feel are ludicrous and wasting space or so trite they should have looked at the book first and come up with something a little more original,surprise
i feel all funny sometimes,surprise
i love and captured an atmospheric feeling in their landscapes that really impressed me,surprise
im feeling dazed and alot of things in my mind,surprise
i purple month doesnt feel surprised in fact zhuo feng up many pupils all clear xiao her identity dont even say main star feng of young,surprise
i was entertaining myself with this memory while at the same time feeling like that guy in that movie dazed and confused who says i just keep on getin older and the girls stay the same age,surprise
i feel like i would order carryout from if i lived in the area i am still curious to try some of their other tacos,surprise
i have spoken about before but the feeling is getting stronger and i am curious if others have similar thoughts,surprise
i feel like i should not be surprised at this development,surprise
i go through my day feeling your movements and am amazed that something so miraculous is happening in my body its like a special secret only you and i have,surprise
i feel curious because i would like to explore what is at the top of the helterskelter like plant,surprise
i am feeling overwhelmed by trying to do it all that i think on the women before me,surprise
i feel thats just strange on wotcs behalf,surprise
i received the blanket i was absolutely amazed on how fluffy it is and extremely soft i really didnt think it was going to feel that amazing,surprise
i feel overwhelmed how about you,surprise
i feel a strange gratitude for the hated israeli occupation of sinai that lasted from to for actually recognizing the importance of sinais history,surprise
i always feel very shocked by that me threatening,surprise
i found myself feeling a bit overwhelmed,surprise
i guess it doesn t help that i got sick on black friday and was forced against my will to maintain my promise to stay in but being back in the city feels amazing,surprise
i feel as though i am on another adventure and i am more curious about it than anything else,surprise
i feel more amazed and more thankful for having e in our lives,surprise
i still sit back and feel amazed by the whole thing,surprise
i have been feeling overwhelmed with it all and needing to take time out,surprise
i replied feeling strange at giving the orders,surprise
i wonder if the homeowners would feel weird if i parked to gape at their landscaping,surprise
i both feel impatience at the rate of loss and impressed at the same time,surprise
i ran errands to buy cora a few newborn sized sleepers i had not previously made any newborn sized babies and went out to lunch to celebrate how great i was feeling i feel amazing no pain no pain meds and moving around almost completely normally at days out,surprise
i think or feel but like this person i am still amazed by them,surprise
i feel shame in a strange way,surprise
i would look up at the sky scrapers and feel amazed that this little girl from montana was there,surprise
i mean the idea is intoxicating of course and it feels amazing when its happening but what happens in the morning when you wake up and you have to go to work and so amp so is all up in your shit about something that is completely impractical,surprise
i start to feel a little overwhelmed knowing i have to make still,surprise
i feel like they bring the characters to life completely and i m always kind of surprised what the actors do do together,surprise
i started feeling a little funny but this was not anxiety but at the time i didnt know so i started to tell my brother man i dont feel good and he said whats wrong i said i dont know but u better drive so i pulled over and let him drive,surprise
i got home and told peter how i was feeling he wasnt shocked at all by what i was telling him,surprise
i stay the more distanced from others i feel it is strange because i sometimes feel like a new friendship is growing or forming,surprise
i just feel like im going no where and that the period of time where i was so very much enthralled with life and the options it proposed is now over,surprise
i don t feel betrayed coz the backstabber had no grounds for their accusation but i m just amazed at some people s ability to do such things,surprise
i feel this strange sort of liberation,surprise
i feel so weird and scattered with all wonders about a million different things,surprise
i feel a bit dazed but so excited i am going to be so protective she is not going to be let out until she is,surprise
i know it can take weeks for a book to go free on amazon and barnes amp noble and in this age where cents can buy a full length ebook i feel a little funny charging even cents for a work that is almost certain to be under pages possibly under,surprise
ive blogged and i feel strange about it,surprise
i cannot even begin to express in words the depth of sorrow that i feel having not posted any of my ludicrous rants over the passed days,surprise
i didn t think it was possible to make a cover that expressed the personality of the novel since it s a strange cross genre story but the photo that was found nails the heart of the book so closely that i feel a bit stunned,surprise
i wanted to skate fast wanted to try everything just to see the difference in feel which was amazing,surprise
i never know how to talk to people after shows i always feel a bit dazed so i hope they didnt think i was rude,surprise
i feel shocked that you d stoup to destinys child b,surprise
i feel so damn curious with what this blond doctor plan to do this night,surprise
i also miss the old curious child within me i just feel that the curious child inside me is dying slowly upon the shock of knowing that the world is not as beautiful as we thought it was,surprise
i just got back from another miler faster than yesterday and im feeling amazing,surprise
i can t help feeling curious about it,surprise
im feeling absolutely amazing,surprise
i suggest you take a look at them when you feel curious enough to know more things about specific english words related to familiar diseases,surprise
i type these words i feel like i shouldn t be surprised,surprise
i did a body scan and realized that everything was feeling amazing,surprise
i feel the pressure to be funny all the time,surprise
im ok with that it feels a little weird,surprise
i am still feeling a tad strange in those pearly whites,surprise
i am feeling amazing and seeing the difference,surprise
i feel a funny mix of emotions,surprise
im feeling a little dazed at the amount of items that i no longer use for decorations,surprise
i am just feeling overwhelmed and there is nothing i can do to fix it,surprise
id been feeling a bit funny all day verging on the kind of pre menstrual where you hate yourself so id been trying to take it really easy and just doing my own thing,surprise
i feel overwhelmed by my circumstance in all of my mere human ness i will remember that god has landed here,surprise
i almost feel a little bit weird about saying anything because it would almost feel like gossip,surprise
i cant seem to get passed feeling stunned,surprise
i need to be able to pursue the creative opportunities i crave without feeling like i m throwing my family under the bus funny how they still want to be fed even when i have a big gig to prepare for,surprise
i feel like such a goof ball for the things i am curious about but i see life as this adventure that i get to embark on and i want to squeeze every ounce of good from it,surprise
i was feeling and was surprised when i told him i felt fine no fatigue,surprise
i saw him on galaxies magazine i feel curious why this singer is so famous,surprise
i know how i feel about spamming when it happens to me and i was not impressed,surprise
im still feeling a little shocked over yesterdays news that pope benedict xvi has decided to resign,surprise
ive never been particularly bothered about my age or the ageing process and while i feel slightly surprised that im nearly i dont really mind,surprise
i seem to feel some fondness for this curious old man,surprise
i just started taking mine yesterday and i feel kinda funny,surprise
i didnt feel like explaining to her that im genuinely curious and want to learn and understand and at least have some idea of what people are saying to me,surprise
i left gastro feeling impressed,surprise
i really did not feel so impressed with houston when i came here last time,surprise
i feel amazed when i saw the final result even thos without fishes inside,surprise
i told my colleagues in the qa team that after knowing almost everything in the floor back when i was an agent now i feel like im a kid curious of almost everything,surprise
i think it is the worst feeling it gives me the shivers and just thinking about it makes my teeth feel strange,surprise
i feel very overwhelmed,surprise
i were howling with comet and the baby was kicking so much for john to feel it was so funny,surprise
i feel less weird about soliciting guys for them because well i am a guy i guess and i dont feel bad about exploiting them maybe,surprise
i had one sip and already i feel dazed,surprise
i feel they are amazing unique people and i love them so very much,surprise
i am left feeling dazed and confused,surprise
i have a feeling they might be pleasantly surprised,surprise
i feel that im most amazed still by silent knight which is an instrumental song ala hizaki,surprise
i shake my hand off which feels slightly stunned from making contact,surprise
i feel really amazed at times at what ive come through in the past months,surprise
i didn t feel amazed,surprise
i am feeling amazing,surprise
i feel and im amazed of how often i think i need to save the world,surprise
i go around people and i act normal but it feels strange,surprise
i feel really strange about this,surprise
i do remember my left quad starting to feel strange not hurting yet an aggravating feeling about a week or two before the marathon,surprise
i just don t feel as impressed and as happy with things like i used to,surprise
i feel so amazing about taking this trip as i think ill finally be able to relax and feel comfortable at home and somehow just melt back into it,surprise
i feel impressed by the professionalism and specifications the maintenance sets itself,surprise
i didnt feel as if i impressed the motherlover,surprise
i get the feeling he was as surprised as everybody else when people started getting sick,surprise
i can t help but feel amazed,surprise
i don t always feel like i have amazing style and most days i choose comfort over anything else but there is one thing that i feel makes all the difference in how i feel about myself and that is makeup,surprise
i am older and my life is very different i can feel how amazed i was that morning,surprise
i feel amazed and surprised when the exact question i am trying to ask,surprise
i feel simply amazed when i look back,surprise
i feel not just attracted to but completely enthralled and captivated by him like hes some kind of other worldly creature with nothing inside him but a really bright light,surprise
i get a day off from writing and feeling pressure to be funny and get to laugh at your stories and share some blog love monday is the wonderful a href http geremiafamily,surprise
i kept trying to feel shocked or depressed or somehow affected but i could not,surprise
i still had the feeling and it surprised me,surprise
i dropped back to sleep for an hour or two and had very realistic peculiar dreams which are now stuck in my head making me feel a bit dazed,surprise
i must say it was first numb then ouch my head feel dazed,surprise
im in the second trimester i feel amazing,surprise
i couldn t help feeling curious about what looked like fishing tackle hung in an adjoining cubicle an outsize plastic mac and sou wester dangled over an enormous pair of wellies,surprise
i have often observed that at times when it seems i should feel something im surprised by how disconnected i feel to the people and world around me,surprise
im watching my sodium which mostly means im feeling stunned and overwhelmed at how much is in everything we eat,surprise
i was willing to be honest with myself and put a name to what i was feeling i was shocked,surprise
i could get fucking stuffed in fucking chocolate without feeling weird and fat do you have troubles sleeping at night,surprise
i am looking forward to how amazing it makes me feel i will probably post more details about it in the coming days for anyone who is curious about this nutty thing we do on occasion,surprise
im not going to lie it feels really weird to be writing this right now,surprise
id been feeling a bit curious,surprise
i still had the feeling something weird had just gone down,surprise
i started feeling funny last monday i just knew i was pregnant,surprise
i feel a strange type of peace with this go around that i never felt with ally,surprise
im feeling very curious ill pull out geology maps,surprise
