Text,Emotion
ive been taking or milligrams or times recommended amount and ive fallen asleep a lot faster but i also feel like so funny,surprise
i have seen heard and read over the past couple of days i am left feeling impressed by more than a few companies,surprise
i keep feeling pleasantly surprised at his supportiveness and also his ease in new situations,surprise
i am now nearly finished the week detox and i feel amazing,surprise
i too feel as if i am a stranger in a strange land and i am raising my son in a place that is not his father s ancestral home,surprise
i started feeling funny and then friday i woke up sick as a dog,surprise
im certainly not going to sit and tell you whats going on in my personal life but i feel that if you were ever curious about whats going in my life all youd have to do is watch the show,surprise
im sorry that there wasnt more humor in this post but im not feeling all that funny,surprise
i want to hold this feeling of shocked awe and wonder forever,surprise
i will enclose her verses on her could not weigh much more thinking and feeling curious to hear the odd couple,surprise
i was feeling an act of god at work in my life and it was an amazing feeling,surprise
i feel curious about all this things around,surprise
i feel herpes coming i would be very surprised at this point if i make it out again after my checkup at the clinic on wednesday,surprise
i feel like that s so weird that i had cancer that one time,surprise
i feel to have these amazing people in my life,surprise
i go up to her and i say feeling very impressed with myself youre naomi klein right,surprise
i feel a bit funny actually,surprise
i always want nemo by my side and sleeping without her now feels weird even though it doesnt happen often that i get to,surprise
i am feeling overwhelmed with the responsibilities of being a teacher that someone is trusting me with their most precious gift and it is an honor,surprise
i feel energized and curious again about life about god about my potential to give something back to society and about finding someone after my heart,surprise
i bought a virtually fat free thousand islands and feeling very impressed with myself hold large quantities of this substance on the leaves of lettuce and cucumber with my friend but it will be total sugar becomes if you do not burn fat,surprise
i honestly am not sure how i feel stunned,surprise
i really want to go buy some yardage of art gallery just to play with because it feels so amazing,surprise
i still feel funny writing that like maybe i should call her my spirit guide or really observant cheerleader or something,surprise
i would rather feel nothing than feel this then do not be surprised if you find your life very depressing and grey and unrewarding,surprise
i get really sweaty during these episodes and my stomach will feel really funny like i m free falling,surprise
i feel so dazed a href http twitter,surprise
i still feel a little dazed and have that sort of disbelieving feeling of oh my god,surprise
i feel surprised by how down it makes me,surprise
i dont know why but i had started to feel the weird pressure of a largely silent audience and with it a falsely inflated sense of importance in expressing myself and my ever so articulate opinions to said audience,surprise
i am feeling overwhelmed i want to physically shake everything off me the way i would if there was a spider in my shirt,surprise
i remember feeling amazed,surprise
i feel about strange brew,surprise
i feel strange with it because it started to be sale,surprise
i feel it is because mccarthy isn t at that place yet in her career where she can really consistently humanize a character while balancing out the fact they are supposed to be funny,surprise
im feeling amazed with my california ness at the moment currently sitting by the pool drinking a wine spritzer out of nagalene connecting via google wifi and using stellarium to figure out the stars,surprise
i also feel a strange sense of guilt about all the people who arent similarly situated to move to a different neighborhood,surprise
i feel like i shouldn t be that amazed with a degree in biology i was blown away,surprise
i was feeling so overwhelmed that i asked my bqff to keep of them at her house until theyre ready to be loaded so i dont feel so behind,surprise
i would always feel amazed at how impacted these and year olds were by this subject,surprise
i missed about a month combined of classes and was pretty much bed ridden for months of the semester i feel really amazed that i was able to pass,surprise
i thought maybe it was just my hands feeling funny but i touched my hair with my totally clean forearm and it became sticky,surprise
i still feel a little dazed and high which is alarming since its been hours or so,surprise
i think of how much time we spent just doing fun childhood stuff together as a family i feel amazed,surprise
i know i would feel weird about that and probably act strangely for a few days,surprise
i feel so deeply shocked and saddened,surprise
i think i brag and it feels strange because i still see myself as a little fattie pre teen unworthy of any male attention,surprise
i believe its possible to be joyful and full of thanks while feeling overwhelmed and exhausted by life,surprise
i feel so weird not saying goodnight to mike,surprise
i feel surprised because i didnt expect it,surprise
i think she just rolled out i guess she s over it already i m kinda feeling that but no one has performed yet and word on the street is there is supposed to be a surprised performance by lil wayne nikki minaj and drake that would be dope,surprise
i try not to laugh because sometimes it hurts vellas feelings but some of the things he does are so funny,surprise
i feel not surprised by where i ended up i m happy with a lot of what i ve achieved the positions i ve put myself in,surprise
i love a movie with a good feel to it that really keeps you enthralled and the road has just that,surprise
i feel funny telling you about my name change anyway gracias por todo,surprise
i am sure at least i hope so that the woman who responded by saying so that he could help out with the kids also feel this way but what surprised me was that all the reasons i listed above were second,surprise
i loved the feeling i got during an amazing slalom run whether it was in training or in a race,surprise
i sit here looking at the sentence i just typed i feel quite shocked,surprise
i understand the feeling so i wouldnt be shocked,surprise
i was feeling pretty impressed with myself,surprise
i feel overwhelmed and humbled but i am alive to keep slugging and i m grateful for the chance,surprise
im feeling so sally field like these days surprised by all the love and always with a brown mop of hair atop my head,surprise
i bore my testimony that listening is one of the most important things we can do and if we feel impressed to do something even if we are unsure about it by learning to follow those impressions we will learn whether it is of ourselves or of the spirit,surprise
i got off in my previous post about how much the app maker leeches upset me at this conference and so i feel like i should mention who i was most impressed with there,surprise
i can look at a stack of twenty five term papers and not feel overwhelmed,surprise
i tell the people closest to me things that i am feeling and its as if they arent surprised because theyd known it all along,surprise
i feel surprised and disturbed actually,surprise
i feel like im pretty weird and open about liking a lot of things i doubt any of my interests would surprise anyone,surprise
i feel kinda strange too cause i didnt encountered with such feelings last year,surprise
i am not sure why i feel the need to share this experience with the world maybe its just that now that its over its actually pretty funny,surprise
i only feel curious impatient eager and confused,surprise
i feel very stunned that people got it in a big way,surprise
i asked darren about it when he got home as i was feeling a bit curious even though it didnt really matter and it was really none of my business,surprise
i tween sat for my moms boss year old and year old boys this weekend id say babysit but that feels weird considering there were n,surprise
i help busy overworked mainly but not exclusively women go from feeling overwhelmed frustrated and generally pissed about their health and appearance,surprise
i feel as if im in some strange catholic vortex,surprise
i have a feeling that many of you will be surprised to learn that after nearly years it s time for me to say goodbye as your guide to entertaining,surprise
i feel shocked have i become that old,surprise
i walked out of there with a better understanding of what was going on in the experiment but also feeling a little stunned that i had only one equation to describe all of this,surprise
i can remember what it feels like to be enthralled by him i cant actually feel it,surprise
ive been reading again and feeling pleasantly surprised to find my reading list contained four similar books a fine chance to compare and contrast differ,surprise
i managed to take some photos today of my outfit which did feel rather strange especially as i havent taken any for such a long time,surprise
i feel like im in some weird dreamworld where i can do absolutely anything,surprise
im feeling really weird,surprise
i was kinda laying on my disappeared arm playing on the computer then i got up to turn eat dinner but on the way adjectives of a sudden this wierd feeling in my collar chest felt like a bounce of electricity shocked me or something then my left paw,surprise
im old enough that graduation and yk feels like just yesterday i find myself a bit stunned by this,surprise
i am a mother though most days it still feels strange to realize i am one,surprise
i really feel amazed on how they can do that,surprise
im still feeling a bit stunned by an experience i had tonight while watching a movie,surprise
i am feeling overwhelmed by daily responsibilities by expectations of my family and job by the demands on my time by my physical tiredness by the feeling that my burdens will overtake me by financial hardships by,surprise
i began to feel curious and tried to percieve who i was beneath my pride and why i am who i am,surprise
i was overwhelmed by the feeling of being impressed i think these kids theyre years younger than me i can call them kids right,surprise
i was feelings amazed imagining how would she feel when she will get this,surprise
i am not sure if we should buy more but my hubby and i are feeling pretty impressed,surprise
i remember feeling surprised that i had the option not to listen,surprise
im feeling so overwhelmed,surprise
i just feel more dazed and alone in the end,surprise
im just thinking back and feeling utterly amazed and grateful that we live in a time when four people who needed a family could find each other despite being thousands of miles apart,surprise
i feel so impressed with ia,surprise
i enjoy all of these aspects of my life it is hard at times to not feel completely overwhelmed,surprise
i sat silent and open mouthed as he rattled off the reasons why he loved me the special times we had shared which had confirmed his feelings and was amazed that they were the same reasons and times together that made me realize how much i loved him,surprise
i feel sort of dazed and cross eyed,surprise
i remember is the feeling of falling and miyavi s shocked face,surprise
i will adjust to it but for now it feels so strange,surprise
i watch her silently feeling dazed from my memory loss,surprise
i sit down to author this letter i feel a little surprised that an entire year has already passed us by,surprise
i can recall feelings of the time we were in coolum whilst laying in my own bed the other day and it s funny how he s calling me and we are speaking everyday now,surprise
i feel absolutely amazed at the unfolding story of my life,surprise
im here today after looking at my bank account this morning and feeling shocked,surprise
i feel weird if i just do completely nothing,surprise
i feel very weird about so much of my psychological safety coming from noah providing money,surprise
i wanted to follow a set of food rules and feel amazing or party hard and suffer the consequences,surprise
i just feel overwhelmed thinking about it,surprise
i drove to pay her for the snack she was looking at me wearily and i was feeling dazed by what just had happened and felt a confidence that is unusual and rare,surprise
i am overly passionate but i love music for how it makes me feel i connect with the songs and the artists and i am amazed and truly in awe of those that can write a song that touches me,surprise
i asked the girls i was with if it was just me or if their eyes were feeling weird also,surprise
i am feeling rather overwhelmed with all that is on my to do list,surprise
i myself smiling through loving simple dialog child logic explain situation feelings it s funny,surprise
i often sat back and feel amazed when the episode was over,surprise
i also feel amazed happy fortunate and extremely blessed,surprise
i woke up feeling dazed and confused,surprise
i pick up the cards i feel a shiver go up my spine and i just feel so curious,surprise
i feel overwhelmed and i want to forget it all,surprise
i typically do not engage the children on my walks in this manner but today i m feeling a little curious and more silly than usual so i persist with my question,surprise
i feel strange with the judge passing sentence in such a manner,surprise
i have talked about it too much i feel here is a video if you are curious,surprise
i forgot my passport and i realize that my stomach was feeling funny until i went to the washroom and understand that i was actually sick,surprise
i feel like i need to emphasize that because i was very impressed with the color of it,surprise
i feel like amazing co screenwriter roberto orcis bizarre adoration of dubya the pampered bush son was responsible for this shit even though it was carried over from the amazing spider man which orci didnt co write,surprise
i don t mean this to be a serious recollection of feelings only a funny in a not funny sort of way story so let s get back to where the action begins,surprise
i am also noticing that i can only handle so much incoming information or i start to feel overwhelmed,surprise
i feel a strange sense of legacy,surprise
i just remember feeling really dazed and amazed that it had all happened little did i know if you are about to have or have just had surgery then good luck i m sure i ve had the bad luck for everyone,surprise
i overly pc in feeling a little shocked,surprise
i feel your prick every night when you re dreaming about me and i she paused dramatically i am not impressed,surprise
i see what the ritalin culture is doing to the children and their flias i feel shocked,surprise
i volunteered for everything and wound up feeling overwhelmed and people got mad at me for not being able to meet my obligations,surprise
i sat there feeling so amazed that i actually found great joy in such simple things,surprise
i read the book and feel like i am travelling those journeys sometimes i am amazed sometimes i cry sometimes i laugh sometimes i yearn for what is written sometimes i remember my friends my family and the deceased and realise there is so much to do for them,surprise
i feel like im giving them a story to tell to their friends and family which is funny because growing up i anticipated to be the one to travel and spontaneously meet an erratic person that swoons me with their life stories,surprise
i ini i feel strange,surprise
i look back on that i feel amazed that at such a young age i could just pull it together like that,surprise
i can say that once again after the test drive we left feeling impressed by the cx and with steve and adams assistance,surprise
i came home still feeling stunned and in need of rest i received a call from a dear elderly cousin marie to say she called an ambulance for herself and would be going to the hospital,surprise
i still feel funny,surprise
im getting there but i really do feel dazed and confused at the moment,surprise
i go in coeur d alene im surrounded by them and it feels strange to look at them and think all these people are actually as nuts as me,surprise
i feel amazed i can compress my difficulty so neatly into one sentence,surprise
i stared up at him amazed by the feeling and as equally amazed that nothing else was happening,surprise
i do however feel that some people would not be so shocked right,surprise
i feel you might be quite amazed if ahead of you begin your diet program you continue to keep a a href http www,surprise
i feel like in spite of having so many amazing things to be thankful for life is just one big demanding wave after wave and i m being tossed around like a rag doll,surprise
i feel too overwhelmed to clean anything so i just let it all pile up until it makes my whole life feel like it is going to come crashing down around me and i am helpless to stop it,surprise
i feel that s the one thing i ve enjoyed about tv people have the time to be shocked over kenny powers and then you have time to let go of it and love him later on,surprise
i feel funny about mothers day,surprise
i think and feel its funny its sad its weird but more than any of that its the truth,surprise
i feel overwhelmed with the uncertainties of life the sorrows lurking about the fears eating at peoples peace the sad choices friends make the effects of those sad choices on loved ones broken relationships etc,surprise
i even feel weird living with lay people again,surprise
i feel weird,surprise
i will cry in front of my children and feel overwhelmed without a moment s notice,surprise
i feel like it s a boy i would be pretty shocked if it was so somewhere in there my gut or my brain is saying girl,surprise
i were saying that we were feeling overwhelmed with our life right now,surprise
i felt fine when we got there but after a short while i started feeling really funny,surprise
i find myself feeling surprised and totally unworthy whenever i see her face,surprise
i feel about my mommy amp me friends our friendships grew so naturally the strength of them surprised me,surprise
i am feeling quite overwhelmed,surprise
i care very little about impressing people unless its a person who i feel deserves being impressed,surprise
i love sunshine havent had much but the feeling of it on my shoulders as i walk around the yard is amazing,surprise
i always tell people my brd armor sucks since i totally feel it does so i was amazed to see some of the crap some brds wear,surprise
i remember feeling bowled over and surprised by my own reaction at the tears welling up,surprise
i honestly have so much research to do and have to think of so many color schemes and how to implement organizational tips for small spaces that i feel more than overwhelmed with the intensity of this project however there is the masochist in me that is incredibly excited,surprise
i only have three words to describe my feelings after viewing them im not impressed,surprise
i feel like i m trying to be that guy who hangs out with curious george,surprise
i feel about politics and i have been very shocked at myself for going into this realm though i think that it is at this time the most important considering everything that has been going on in the world stage and in the usa,surprise
i wish it was a more comforting feeling but instead it feels strange like living the memories of someone else or maybe having woken up from a long dream or a long sleep years and finding that the trees around you have grown taller,surprise
i heard a song on the radio yesterday that just made me feel amazed at the lyrics,surprise
i have a feeling that even if this was the only line up there jesse might make the hike all over again just to finish this amazing project,surprise
i feel like im in this weird in between stage,surprise
i sleep in a dreamy state waking up feeling dazed every now and then yet the cyber slut in me craves to creep up on here every evening,surprise
i could just picture it with it homely feel and also having the smell of books would just be totally amazing,surprise
i do feel so funny about myself because i seems to want to have good guy image although i have been keep saying wanna go clubbing but ended up did not even go once,surprise
i was feeling pretty impressed with my potential new boss,surprise
i feel curious to know more i think the procedure worked well,surprise
i feel many readers are amazed by the many ways the whitley family has influenced hollywood and continues to influence today,surprise
i know this isnt real but it feels strange to me at times,surprise
i feel all funny just thinking about it,surprise
i feel like if you can t admit that you ve always been a little bit weird or a little bit quirky it s just taking yourself too seriously,surprise
i feel curious about this one i think i might fall in love by uncle montagues tales of terror,surprise
i don t think anyone feels curious about masala movies they are just light entertainers,surprise
i didnt feel surprised i didnt feel upset i didnt feel angry i didnt feel anything,surprise
i remember feeling surprised and stunned that a writer of the stature and quality of lauren had read one of my books long ago,surprise
i was grateful for each and every one but it still made me feel funny,surprise
i beside see smiling feel very funny,surprise
i knows is the boy makes her feel weird and yuuki doesnt know what to tell her,surprise
i feel strange actually sitting beside some people i don t know,surprise
i feel stumped something comes out of my pen and im always a little amazed by this,surprise
i read through the ol feefyefo space i feel amazed at how much i could blabber and how transparent i was with my life,surprise
i wander into the depths of the markets because i m feeling curious,surprise
i was on the phone with tech support today and it turns out i have something in common with the guy on the phone we both have thoughts and feelings are are curious about this world,surprise
i am feeling so stunned and sad about the earthquake in christchurch new zealand yesterday,surprise
i feel is strange rel bookmark november a href http eagleandhammer,surprise
i feel curious reserved habits was nothing else,surprise
i feel amazed at the world,surprise
i feel like a strange antisocial creature difficult for the cooperation,surprise
i get the feeling he is telling peter many people will be surprised,surprise
i feel like all i ever do anymore on the internet is bitch about my kid but seriously im amazed that so many children survive toddlerhood,surprise
i don t know if i would enjoy those books now but i still remember feeling enthralled with those characters and with the amish lifestyle presented,surprise
i was feeling amazed because i didnt find myself that good as what they have commented,surprise
i feel curious excited and impatient,surprise
i am feeling insatiably curious and i want to read and learn more about digital media and social marketing,surprise
i have learned so much with him even now i still learn new things about rabbits i feel you always keep learning about them being amazed by them,surprise
im still feeling very incredibly overwhelmed with the entire situation,surprise
ive ever written although im not gonna reproduce it here because it is full of boring academic references and also it specifically analyses several prominent bloggers and their treatment of romantic relationships and id feel weird about putting that on the internet,surprise
i woke up feeling amazed and then i realized that a dream is still a dream,surprise
i also came away injury free and feeling amazing throughout the entire race,surprise
i even feel surprised if its dark outside,surprise
ive gotten so used to them to the extent that im actually feeling weird without them,surprise
i feel pretty weird blogging about deodorant but im a bit of a deodorant snob and find it really hard to find a good one,surprise
i was talking to my district leader elder hill last night and was explaining to him some of my concerns such as not seeing the fruits of our efforts not having baptized anyone yet and just plain feeling like i have so many problems and weaknesses that its not even funny,surprise
i still blush and feel shocked about the recreational activities that i sometimes unwillingly and willingly hear sometimes,surprise
i feel lola falls under this strange demographic,surprise
i have chose for myself that makes me feel amazing,surprise
i feel that they were just as surprised to be sharing my dream as i was to have them sharing it,surprise
i feel almost weird that someone i didnt know has impacted me emotionally these last few days,surprise
i like to do things that leave others feeling surprised and delighted,surprise
i lose friends because they apparently dont like that i tell people how i feel its funny how that works,surprise
i gotta say im feeling pretty impressed with how everything ended up considering my total dollars dropped totaled and i have three small canvases to play with display with,surprise
i have a plan with friends and a good support system of neighbors to keep me company but it still feels really weird,surprise
i remember feeling equally dazed and road rollered when the twins came home and that was with the pee and poo all neatly tied up in diapers,surprise
i do i feel very impressed with the one who made the story,surprise
im still feeling the effects today in that my body isnt particularly impressed by me at the moment and it feels a but stressed out trying to sort itself out,surprise
i feel like in a way i kinda shocked my body by changing my calorie intake,surprise
i have been feeling overwhelmed and time poor,surprise
