Text,Emotion
i feel so impressed by a dental work in front of me as well as a cost which we am deliberation suicide,surprise
i left feel serence and impressed by the man he is,surprise
i feel like im not gonna lie im really surprised that i feel like i should share this,surprise
i really want to watch it for the obvious romance reasons and i have a feeling like it would be a really funny kind of drama too i can also somewhat relate to the female main character who works with this boss who has a lot of pride and is a bit what you would like to call him as cocky,surprise
i am feeling overwhelmed i dont feel hopeless to often but i do cycle through frustration anxiety and sometimes anger that i have to go through this,surprise
i feel dazed and empty and like somthing is missing in my brain,surprise
i feel like this sums up the vanity of humans funny pictures funny quotes funny memes funny pics fails autocorrect fails,surprise
im going to be very honest with you it feels amazing,surprise
i feel funny things happening to my face and all over my body,surprise
i feel funny inside is that a reference to the circus going on in his underpants,surprise
i almost feel funny not adding a picture at the bottom of my post like denis and dave,surprise
im just feeling so dazed everyday,surprise
i as representative of everything thats wrong with corporate america and feel that sending him to washington is a ludicrous idea,surprise
i feel i should make is how surprised but entertained i was by the inclusion of so many popular culture and gaming references in the story mode of the game,surprise
He looked down at her astonished face with darkly angled,surprise
His eyes flared over her astonishe,surprise
"Her astonished eyes were taking in his costume : gold-embroidered satin jacket , knee breeches and jabot of the eighteenth c",surprise
He discovered to his astonishment that Frank now professed a,surprise
It was a measure of Arnold 's astonishment that he used the dialect expression of c,surprise
She realised with astonishment that he was actually pl,surprise
"He stopped , becoming aware of the glare from his uncle and the frank astonishment from his",surprise
The anger and astonishment in her face gave way to something very lik,surprise
"The boy bowed again , enjoying her astonishment in the same way he had enjoyed the applause of the T'ang earlier that day when he had played Ts",surprise
"I heard no more of the debate and to the astonishment of my fellow delegates I stormed out of the auditorium and locked myself away in the Ladies to howl out my rage ,",surprise
"It was there , that same until-then-pleasant morning , to the astonishment of all the workers in the Library , that Stour stumbled into the Great Chamber and laid his burde",surprise
I chuckled at the astonishment on he,surprise
"Suddenly , to the Collector 's astonishment , the Padre gripped him by the throat and shouted : "" A matter of o",surprise
"As he drove out of his allotted space , to his astonishment he saw Alexandra about to get into her white ",surprise
Bob sat up on the bed and gazed at her in astoni,surprise
The driver watched in astonishment as the car whacked into the side of his v,surprise
"Her eyes were wide open , and upon her face was an expression of absolute astoni",surprise
"Sonia and Helen flung themselves into my arms , to Joe 's great astoni",surprise
"But when I looked up , I saw , to my great astonishment , a large island in the sky , between me and t",surprise
"To her own mild astonishment she murmured , ` I 'll",surprise
Rebecque could not hide his astoni,surprise
As he looked around he could not hide his astoni,surprise
"Chambers shot him a look of astonishment , then turned to incl",surprise
Elaine Morris stared out of the window in astoni,surprise
He left so quickly that she stared in astonishment at the door he had closed behi,surprise
"` A great number , "" said the astounded Mrs ",surprise
"` You keep them , "" she cried , throwing the jewels into the plump lap of the astounded Soapy Fi",surprise
"Before the astounded car owner could react , the Prophet had pulled the door shut , reached over the back of the driver 's seat and jammed the muzzle of the gun into the man '",surprise
" What in the world  ?  began Rose , feeling quite bewildered as he let out an amused",surprise
"Lucy felt slightly bewildered , but hid the fact as she turned to ",surprise
"She frowned , feeling slightly bewi",surprise
"A delighted , if somewhat bewildered smile tugging at her own mouth , her eyes alight with laughter , she watched him melt into the ",surprise
"Schellenberg went out , closing the door , feeling totally bewi",surprise
Joey seemed bewildered as he put one large hand on his mother 's sh,surprise
Andrus seemed totally bewi,surprise
"At first , she was utterly bewildered when he burst out la",surprise
Kate 's voice was husky and bewi,surprise
BANGOR 'S Alex Lightbody must be the most bewildered bowler in the NIBA this ,surprise
By now Nutmeg was so bewildered that he did n't know what,surprise
Natasha laughed at Maggie 's bewildered expr,surprise
"Benny looked around him , a bewildered expression on hi",surprise
He saw the bewildered look on Hencke 's face and led him towards two comfortable chairs which stood on either side of a low occasional,surprise
"And she did , leaving a very bewildered Ellie to look round her at the well-equipped kitchen and the gently steaming ",surprise
"The sweat of moving packs of eighty pounds through the crush of bewildered , nervo",surprise
Some even asked the bewildered woman to sign their,surprise
A bewildered Dick Francis walks back to the weighing room as Devon Loch is le,surprise
"When she still looked bewildered he said more harshly , ` I 'll take the heat off if you 'll show some apprecia",surprise
Police found the exhausted pensioner bewildered by the ro,surprise
"At a nervous and hurriedly arranged press conference , the Ibrox publicity machine could barely paper the cracks between the departing boss and his bewildered ch",surprise
Within moments the bewildered assistant cooks had tied the ropes to the cauldron and suspended the boiling mass over a forked spi,surprise
"She just looked up at him with bewildered eyes and he put her firmly away , turning to launch himself into the",surprise
"Michael frowned at him , bewi",surprise
She was feeling hurt and a little bewi,surprise
"The children , at least the younger ones , become bewildered and dist",surprise
"A bewildered and shocked survivor can be guided through red tape , and practical alternatives can be found , as in the case of Liz and Tom who were burgled while on Income S",surprise
"Depressed and bewildered because it had inexplicably impaired his ability to think and concentrate , he soon guessed that his paralysis and clumsiness would make him always dependent on a whee",surprise
"What had once been a largely invisible world of mental hospitals , private suffering , and professional services now appears in local communities as homelessness , strange persons in public , and bewilderment about who is responsible fo",surprise
She squinted in bewilderment at the ten or so boarders who had formed her little band of h,surprise
""" No , "" I said , trying to sound convincing but daunted by the simple bewilderment in hi",surprise
"` Carpenter ? "" her father asked with a tinge of bewilderment in his",surprise
She did n't want to trouble the penguin with the bewilderment in he,surprise
"The old hands at machine knitting glibly talk about ` two-thirties "" to the bewilderment of the newcomers at the knittin",surprise
The bewilderment of the child Nizan can not be over,surprise
"Scott ran a hand through his hair , bewilderment on hi",surprise
"Downstairs in the lobbies , Tories were running around in equal bewilderment over the Speak",surprise
To her bewilderment they both dissolved into g,surprise
"She saw his fear , his bewilderment , and above all , a kind of astonishment at the enormity of the complications that lay",surprise
"The other side of the story is the pain felt by women when their children suffer , and their bewilderment when that suffering is self-inf",surprise
"His voice was as sensual as raw silk , but when he saw her bewilderment his eyes drifted over to Mandy 's",surprise
"Gloria stared , her mouth agape , then turned to Ruth in bewild",surprise
"She got up and checked the wardrobes , and her bemusement became sheer bewild",surprise
A frown of exasperation lined her brow as she shook her dark head in bewild,surprise
"Sonny turned in bewilderment to Johnny , then lumbered out after his b",surprise
"To those workers who profess bewilderment as to how they might help , who feel their knowledge in sexual matters is insufficient or are doubtful of their capabilities for sexual counselling and aid , one would suggest that they raise the matter within their training depar",surprise
"The rest simply stood in a state of considerable bewilderment , trying to ensure that they had not only accurately recorded but also understood what Woolton ha",surprise
Shiona frowned at the phone in total bewild,surprise
"Most will privately confess to an initial sense of utter bewilderment , but necessity will drive them to adapt to their new way o",surprise
"Her lovely face reflecting her complete and utter bewilderment , she queried slowly , ` Why on earth would I want to claim kin",surprise
Constance looked at him in bewild,surprise
Mr Stokill must have noticed my look of bewild,surprise
He paused as his mother stared at him in bewild,surprise
"She seemed flabbergasted , but rallied and asked me if I would look in at the Gray Mare in Kilburn and say ` hello "" to her son Joe Kelly who worked",surprise
I tell you I was flabbergasted and right terrified out of m,surprise
"Charles was absolutely flabbergasted , but he had n't really got time to analyse his rea",surprise
` At first I was too flabbergasted to do an,surprise
"Utterly flabbergasted , Leith began to realise that he was accusing her of announcing their ` engagement "" to all and ",surprise
Rachel had been nonp,surprise
She was totally nonp,surprise
"Mait was momentarily nonplussed , but soon recovered , as he mentally ran through the possible effects of this on hi",surprise
"It is also worth speculating on the fate of what must have been a nonplussed Christopher Chryselius , Sir John Pennington must have been thoroughly annoyed at the outcome",surprise
He looked quite nonp,surprise
"Usually so mentally attuned , so aware of what she was thinking and feeling , he looked angry and nonplussed , unable to understand her with",surprise
"Ethel shook her head in puzzlement , but a gleam had been coming into Eames '",surprise
Emily could see his puzz,surprise
"Quick -- sign the register , get out , escape from the puzzlement in he",surprise
I pointed out that I kissed Frankie but she dismissed my puzz,surprise
"Claudia , frowning , turned to gaze at him in total puzz",surprise
Had witnessed her puzzlement and then her shocked surprise as she realised what ,surprise
Paul 's tone and expression showed his puzz,surprise
He could see Harry 's puzz,surprise
And now she could see the puzzlement on everyone ',surprise
He saw her glance up in puzzlement and ask why he was still fully d,surprise
"Pitching my voice to a tone of mild puzzlement , I called , ` What 's a rattlesnake doing up ",surprise
Her brow creased in puzz,surprise
"` Can it really work ? "" enquired his startled col",surprise
"Gus said : ` Of course ! "" in a slightly startled voice , and visibly withdrew his vision and his thoughts from some distant preoccupation in which she had n",surprise
They burst in on the somewhat startled signalman who was puzzled by the dramatic appearance of the two familiar,surprise
The man turned round and looked at Robyn with startle,surprise
Their heads were close together and as he appeared they all looked up in unison with startled faces and fell ,surprise
His eyes were so far out of his head that he looked like a startled grass,surprise
She looked startled when I snapped at her : ` What have they worked,surprise
The girl looked st,surprise
Maurice seemed st,surprise
Jinny was so startled that she nearly kicked the bucke,surprise
Corbett stopped his horse and turned to the startled ,surprise
She gave him a startled ,surprise
"And having made the mistake a bird seldom gets a second chance , for the startled butterfly takes off , not in the direction the bird might have expected but , apparently , bac",surprise
He laughed at Claudia 's startled expr,surprise
"No less a person than Gloria Estefan rang my startled publisher before leaving London , to order the Ology book , because she was crazy for the comme",surprise
"Ana started to laugh and Mitch gave her a startled glance and then laughed ruefully too , giving her",surprise
Then his startled gaze met the glowing eyes above the white patch of the handkerchief the man was holding at his,surprise
"` About what , dear ? "" she asked in a startled",surprise
"Before she could utter the cry of alarm which rose in her throat his hand had closed over her mouth , and Paige 's startled eyes blinked at him over t",surprise
"Lucy felt startled , but forced herself to remai",surprise
"Herman , startled but pleased , moved in , only to be disconcerted as Erika pushed hi",surprise
Israel and I pushed by the startled and helpless usher and swaggered into the arena dressed in our Mau Mau un,surprise
"The man stared at her in stunned silence , his chest rising and falling with some kind of agi",surprise
The Germans still seemed s,surprise
The man seemed s,surprise
"With a last , quizzical look at her slightly stunned expression , he waited for Mike to join him , then both men walked out of the suite , leaving her alone wi",surprise
"Then Isabel saw Ellen 's stunned face and realised that her maid , at least , did not know she had spent the night",surprise
"For a moment there was a stunned silence from his workmates and then pent-up breath was released in what seemed like a communal sigh , before the chief waggoner yelled , ` C",surprise
"Anne watched her for a few moments in stunned silence , trying to decide if she meant what she ha",surprise
"I am stunned to find him so fine and ruddy in the startling , bleak white of this room ; so handsome in the face of my decay , my washed-out skin and faded eyes , my smears of blood and perspi",surprise
A stunned Mrs Hanley said as she left court : ` We never wanted anybody to go to prison over ,surprise
"The Odones were left stunned when they were told in 1984 at the Children 's Hospital in Washington DC that their fun-loving , brilliant six-year-old son -- he already spoke three languages -- had ALD , and was under sentence of",surprise
In front of stunned mourners he told grieving widow Linsay Robinson to ` pay up or ,surprise
"In her ` Daughter of Evil "" ( McShane , 1980 ) she stresses her own lifelong affection for her mother and her stunned reaction at being convicted and sen",surprise
"First of all the crowd was stunned , and then they erupted , giving Allan a marvellous reception on his lap of honour But the night was yet",surprise
"The next thing he knew he was lying on the floor , half stunned , beans ever",surprise
"When anything important happens you 're stunned , and thrown out for a while , and then you",surprise
"She looked stunned , almost like a sleep",surprise
"Maggie was stunned , but not for long ; her temper su",surprise
` Tears of rage and despair have been shed by SNP workers and our voters are s,surprise
"Shadow ministers , who had been behaving as if they were about to move into Whitehall , looked stunned and sha",surprise
Most Germans looked on stunned as the results from the two state elections on 5 April flashed across their television s,surprise
"Julia , stunned but dry-eyed , had given her statement to the ",surprise
He was a bit stunned and rushed home to raise the,surprise
"She took two or three large breaths over the top of her bag of groceries , while Mrs Stych watched her stupefaction with compl",surprise
I can understand the apparent stupefaction of all p,surprise
"Taking advantage of Guy 's momentary stupefaction , she wriggled out from under him and leapt off the bed , everything forgotten but the need to escape from something she dared not put a n",surprise
Another step forward and Pooley noted to his utter stupefaction that it had vanished altogether into emp,surprise
Downes shook his head in stupef,surprise
"Athelstan sat in complete stupefaction , drinking his beer , as Cranston cleared every platter , washing it all down with another bowl of ",surprise
"Except the O'Neil family in the first row of the circle , who sat in stupefied amazement , hardly believing what they had wit",surprise
"If the birds are disturbed during the process , there could be large numbers of stupefied birds fluttering amongst the traffic as the morning progresses with public complaints resulting , "" the report ",surprise
It was Blackberry who bullied the stupefied Pipkin to his feet and forced him to limp the few yards to the grave,surprise
"He woke stupefied , flicking his tongue over his parched lips like a r",surprise
Laura stared up at Ross in stupefied ama,surprise
"The pain had faded into the background and she was starting to feel stupefied , her head stuffed with cotton wool , her eyes",surprise
